name,id,tier,rarity,tags,uiTags,base value,unlocked,hidden,hiddenEverywhere,tech/manufacturer,cost_frigate,cost_dest,cost_cruiser,cost_capital,script,desc,short,sprite
Test Hullmod,ASH_TestHullmod,3,,special,Special,15000,true,,,ASH,5,10,15,20,data.hullmods.ASH_TestHullmod,Hullmod for testing purposes. %s/%s/%s/%s,,graphics/hullmods/default.png
Reactive Shields,ASH_ReactiveShields,3,,defensive,Shields,15000,true,,,ASH,5,10,15,20,data.hullmods.ASH_ReactiveShields,Reduces damage taken by shields as hard flux levels rise up to %s at %s and above hard flux levels. In return the ship's shield arc will also go down as hard flux levels rise down to %s at %s and above hard flux levels.,,graphics/hullmods/default.png
Energy Flux Regulators,ASH_EnergyFluxRegulators,3,,offensive,Weapons,15000,true,,,ASH,5,10,15,20,data.hullmods.ASH_EnergyFluxRegulators,"Increases or decreases damage and flux cost of all energy weapons as flux levels rise and fall, up to %s and down to %s.",,graphics/hullmods/default.png
Volatile Warheads,ASH_VolatileWarheads,3,,offensive,Weapons,15000,true,,,ASH,5,10,15,20,data.hullmods.ASH_VolatileWarheads,Increases the damage of missiles by %s but decreases the health of missiles by %s.,,graphics/hullmods/default.png
Subverted Shields,ASH_SubvertedShields,3,,defensive,Shields,15000,true,,,ASH,5,10,15,20,data.hullmods.ASH_SubvertedShields,Increases the damage taken by shields by %s and increases the chance of EMP arcing by a factor of 2. In return the shield upkeep is reduced by %s and the ship can dissipate %s of hard flux even when shields are active.,,graphics/hullmods/default.png
Conductive Rails,ASH_ConductiveRails,3,,offensive,Weapons,15000,true,,,ASH,5,10,15,20,data.hullmods.ASH_ConductiveRails,"Increases the damage, range and projectile speed of all ballistic weapons by %s but increases the flux cost by %s. Bonuses and pentalties are in full effect below %s flux levels but beyond that the efficiency of this effects are reduced.",,graphics/hullmods/default.png